tweets,user,location,polarity,sentiment
ugh are you seriously going drop fox sports during nfl fifa world cup season,1598466975646318596,0,-0.3333333333333333,-1
rt one love one win out fifa world cup 2022 bye bye jerman se you next play,1598466613116014592,0,0.43333333333333335,1
rt lionel messi was given motm award vs poland by fifa as shown official fifa page messi gave award,1598466242385707008,0,0.0,0
rt fifa has approved my argentina v australia game finally i will snap messi oh my balls dream come true,1598465804080660480,0,-0.01666666666666668,-1
follow us win designer sunglasses,1598465391038169088,0,0.8,1
most your guests didn t want come your country but you bought fifa so it was necessity see world cup live i doubt you ll get many them wanting return,1598464994630590464,0,0.37878787878787873,1
